title,tags,author,published_date,official_date,posts,featured_image
['Google Nexus 6:What to expect'],[],['By Yural Maskey -  '],"['August 7, 2014']",2014-08-07 10:09:14+00:00,"['Google Nexus 5 was announced in October last year and we expect the same this year too. Nexus 5 was one of the best flagship phone and that too at a very reasonable price of $350! Nexus 5 was manufactured by LG but we expect some changes this time around.It is being rumoured that Nexus 6 will be manufactured by Motorola. According to leaked information, Motorola is working on a handset with a 5.9in display so could this be the Nexus 6? I personally don’t want the screen to be that big.\xa0Moreover, there has been plenty of talk about QHD displays and upwards of 3GB of RAM. On the hardware segment,\xa0there is a rumor that the processor will be two\xa0MediaTek 64-bit chips-the MT6732 quad-core 1.5GHz and the MT6752 octa-core 2GHz. That’s interesting! We don’t know how good this mediatek chipset performs but we know how the latest Mediatek processor performs. It would be better if they go for Snapdragon 805 SOC.\xa0  Battery was the only disadvantage\xa0of the Nexus 5 with its 2300 mAh battery failed to perform under heavy usage. However, Nexus 6 is rumoured to have a whopping 3000 mAh battery, but that depends on the screen size because if it’s 5.9 inch screen, then the 3000mah battery is mediocre.On the camera section, Necus 5 had a 8 MP OIS camera which had a sof tware issue during it’s launch but was immediately debugged with the software. The best thing about\xa0Google’s Nexus range is its Android software, and both the current Nexus 5 and the future Nexus 6 will be getting the same\xa0Android L software. Android L,rumoured to be known as Android Lolipop has a host of new features including Material Design,\xa0Project Volta,&\xa0Android Runtime (ART).  So the question is\xa0how many of you are waiting for nexus 6?']",['https://oss.gadgetbytenepal.com/wp-content/uploads/2014/08/10599294_342445159256456_8519122343823824677_n.jpg']
['Deals: Samsung decreases the price of Grand 2'],['Samsung'],['By Yural Maskey -  '],"['August 6, 2014']",2014-08-06 11:10:22+00:00,"['Grand 2 was launched here in Nepal  for a hefty price of Rs.36,900 here in Nepal, but now IMS (International Marketing Services), the authorized dealer of Nepal, has slashed back their initial price of Rs. 36,900 to Rs.30,900 (Rs. 6000 off) with opportunities to win cash back.  Grand 2 is one of the best phones under this price segment. It offers a 5.2 inch 720P screen, Snapdragon 400 chipset and 1.5GB of RAM. It has an 8MP rear camera and a 2MP front camera. Powering is a huge 2600mAh battery. It currently runs on the latest version of Android Kitkat 4.4.']",['https://oss.gadgetbytenepal.com/wp-content/uploads/2014/08/Samsung-Galaxy-Grand.jpg']
['Colors K22 Octa: Quick Hands on Review'],"['Colors', 'Reviews']",['By Yural Maskey -  '],"['August 6, 2014']",2014-08-06 09:43:53+00:00,"['Colors K22 smartphone\xa0was launched a few weeks ago and it arrived at our office last week. We\xa0had some brief hands-on time with K22 Octa and now I am going to tell you my initial thoughts.The K22  The K22 octal looks gorgeous but when you feel in your hands you will get disappointed with its  cheap plastic build quality . Despite that, it has a slim figure with 8mm thick. It is not heavy as well. It should weigh\xa0around  130gms .  The  5-inch  screen is decent. It has a good color saturation and is bright and vivid. I actually thought K22 had a full HD screen, when I started watching FHD videos on youtube I\xa0found some pixels and hence realized it’s only an  HD screen , nevertheless the screen is good compared to the competition.        The back of the K22 is removable and you can have access to the  2200 mAh battery . There are two SIM slots (2G+3G). There is a  microSD slot  for memory expansion. Powering this device is a true O cta core MediaTek processor  running at 1.7 GHz. The processor is a Cortex A7 build which is not so powerful. A  2GB of RAM  assists the multitasking department. Quoted with a price of  For a price of  Rs.29,500 , that’s some specs but we are unaware of how it really performs in the real world. There is a  13MP camera  which did well, to be honest. But more about the camera performance will be known as soon as I start taking pictures at a different scenario. Overall it looks like a great phone for this price point. The  5MP camera  also looks promising for selfie enthusiasts. But nothing can be said as now. We will tell you more about this phone in our full review.  Overall it looks like a great phone for this price point. But nothing can be said as now.We will tell you more about this phone in our review.  UNBOXING & HANDS ON VIDEO:']",['https://oss.gadgetbytenepal.com/wp-content/uploads/2014/05/10549052_729949370384459_7471655880106375220_o.jpg']
['Price of Titanium S1 Plus in Nepal'],['Karbonn'],['By Yural Maskey -  '],"['August 6, 2014']",2014-08-06 04:42:37+00:00,"['Karbonn Titanium S1 plus was\xa0officially announced in Nepal,but now it’s available for purchase at a price of \xa0maximum retail price of Rs. \xa010778 with Free 8GB Memory card. Titanium S1 plus\xa0 shows\xa0 Karbonn ‘s \xa0ambitions to make a decent smartphone in a low price segment. It\xa0offers Quad core snapdragon processor,1 GB RAM,5MP camera with flash and a 4 inch screen.   KEY SPECS OF TITANIUM S1 PLUS:   SIM: Dual (3G enabled)  OS: Android v4.3  Screen: 4.0″ \xa0(480 * 8000) TFT\xa0capacitive  Processor: Quad-core 1.2GHz Cortex-A7( Snapdragon 200)  RAM: 1GB  Storage: 4GB internal with microSD up to 32GB  Primary Camera: \xa05.0 MP with LED Flash  Secondary Camera: \xa0VGA  Connectivity: BT 4.0 with A2DP, Wi-Fi, Wi-Fi Hotspot  Sensor: Accelerometer, Proximity  Battery :1500mAh     Pros:   Great\xa0phone under this price category  Quad-core processor at low price   \xa0Cons:   Average Camera performance  Build quality          \xa0  VERDICT  Because of Snapdragon 200 processor and Adreno 302 GPU,the performance will be smooth.We have a 4 inch display which might not be bigger for some users though. It packs a 1500 mAh battery which should do more than enough.We also have a 5MP shooter with LED flash.The camera performance is good considering its price tag. Overall, in this price bracket it’s a great phone and we recommend you to go for it!  Price of Titanium S1 Plus in Nepal->Rs.\xa010778 with Free 8GB Memory card']",['https://oss.gadgetbytenepal.com/wp-content/uploads/2014/08/karbonn_titanium_s1_plus_orange.jpg']
['CG Digital launches LG G3 smartphone in Nepal'],['LG'],['By Yural Maskey -  '],"['August 1, 2014']",2014-08-01 07:48:55+00:00,"['LG G3 smartphone in Nepal  CG Digital,the authorised dealer of LG smartphones in Nepal, has finally announced LG G3 smartphone. It is available for a price of Rs.77,777 \xa0with free quick circle case worth Rs.7777 for first 100 users.You can buy from \xa0CG Digital ‘s \xa0 official website. There are two version of LG G3: One with 16GB internal/2GB RAM and the other with 32GB internal/3GB RAM. The version that is being launched in Nepal is the 32GB internal/3GB RAM version.  CG Digital,the authorised dealer of LG smartphones in Nepal, has finally announced LG G3 smartphone.  \xa0  Last year’s  LG G2  was a great\xa0phone that got people’s attention, and the LG G3 will certainly\xa0make the company a serious challenger. It features the same top-of-the-line processor found in the Samsung Galaxy S5 and the HTC One (M8),however it has got a QHD screen with a whopping pixel density of 534ppi. This is the best screen ever seen in a smartphone.        Under the hood we find that the LG G3 is being powered by a Qualcomm MSM8974-AC Snapdragon 801 SoC boasting four Krait 400 cores clocked at 2.5 GHz and an Adreno 330 graphics chip.The\xa0LG G3 is being powered by a 3,000 mAh battery which, unlike on previous models, is user removable.   The G3’s 13 MP rear camera is one of its strongest features. It has a 13MP IOS+ camera\xa0with\xa0 IR\xa0laser rangefinder and an IR camera for perfect focusing.On the front there is a 2.1MP selfie camera. Check on the full specs here:\xa0  DIMENSION   Size: 74.6 × 146.3 × 8.9 mm  Weight: 149 g Medium   DISPLAY   Screen Size : 5.5 Inches  Screen Resolution:\xa0 1440 x 2560 pixels (534 ppi pixel density)  Display Technology: IPS LCD  Display Features: Accelerometer, Gyroscope, Light Sensor, Proximity Sensor  Protection: Gorilla Glass 3   HARDWARE SPECS   Processor Speed: 2.5 GHZ × 4 Cores  Chipset: MSM 8974AC  RAM: 3 GB  Internal Memory: 32 GB  Memory Card: MicroSD up to 32GB   CAMERA   Camera Resolution : 13 Mega Pixels(4224 × 3168)  Flash: Dual LED  Front Camera: 2.1 Mega Pixels High  Rear Camera Features: Auto Focus, BSI Sensor, Clear Shot HDR, Face Detection, Geotagging, Image Stabilizer, ISO Control, Panorama Mode , Video Stabilizer   CONNECTIVITY   Bluetooth :V4.0, A2DP, LE  Wi-Fi: \xa0 Wi-Fi 802.11 a/b/g/n/ac, dual-band, Wi-Fi Direct, DLNA, Wi-Fi hotspot  NFC  USB OTG   BATTERY   Li-Ion 3000 mAh battery  Removable']",['https://oss.gadgetbytenepal.com/wp-content/uploads/2014/08/lg-quickcircle-case.png']
['Samsung’s metal phone to be unveiled on August'],['Samsung'],['By Yural Maskey -  '],"['July 31, 2014']",2014-07-31 09:24:50+00:00,"['Samsung’s plastic phones are a crap! Finally they will be launching a phone named as “Galaxy Alpha” that has a metal frame. It wont be the new flagship and as per the rumour it will sport a 4.7 inch High Definition Screen, not the full HD,2 GB RAM, QuadCore Snapdragon 800 SoC,32GB internal storage and a finger print scanner. We expect this\xa0metal cased phone to provide direct competition to iPhone 6 which will come at the similar screen size.']",['https://oss.gadgetbytenepal.com/wp-content/uploads/2014/07/samsung-galaxy-F-render1.png']
['Samsung Galaxy Core 2 with Android 4.4 KitKat Launched in Nepal'],['Samsung'],['By Yural Maskey -  '],"['July 31, 2014']",2014-07-31 06:36:28+00:00,"['IMS, the authorized dealer of Samsung Mobiles in Nepal, has launched the Galaxy Core 2 smartphone at a price of Rs. 17,900. The Galaxy Core 2 is now available in Black and White colours via Samsung’s official Smart Café store.   The Galaxy Core 2 is the successor to the popular Galaxy Core launched\xa0\xa0 last year at Rs. 24000.Galaxy Core II comes with a 4.5 inch WVGA screen, a quad Core processor running at 1.2 Ghz, 768 MB of RAM with 4GB internal storage that is expandable via Micro SD up to 64 GB. It houses a 5 MP rear camera with LED flash and a 0.3 MP front camera. For connectivity, it has WI-FI, WI-FI direct and WI-FI hotspot. There is a 2000 mAh battery which is removable. The device runs on the Android Kitkat 4.4.2 out of the box with touch wiz UI on top of it.        Specifications & Features:   4.5″ WVGA TFT display with 800×480 resolution – 207 ppi  Dual SIM Support  1.2 GHz Quad Core processor  768 MB RAM  4 GB Internal Memory with MicroSD Expansion slot  5 Megapixel AF Camera with LED Flash  VGA front camera – 0.3 MP  Android 4.4 KitKat with TouchWiz Essence UX  Bluetooth 4.0, Wi-Fi b/g/n  GPS with GLONASS support, Accelerometer  2000 mAh battery  14 language support    PROS:   Running Android 4.4.2 Kitkat  Better after sales services   CONS   Low Display Resolution  Camera capabilities   Our Opinion  Looking at the spec and pricing, it’s a good phone but we wished it had at least 1 GB of RAM. Being a successor, it has less RAM and less internal storage. For the same price tag, you can go for Colors K1 Amoled or LG L70 which in our opinion is a better handset than Core 2!  Also See->   Top 5 smartphones Between Rs.15000 to Rs.20000\xa0  HUAWEI HONOR 3c REVIEW']",['https://oss.gadgetbytenepal.com/wp-content/uploads/2014/07/samsung-galaxy-grand-2-2511.jpg']
['Huawei Honor 3c Review: Best Value Midranger?'],"['Huawei', 'Reviews']",['By Yural Maskey -  '],"['July 28, 2014']",2014-07-28 09:05:45+00:00,"['Huawei introduced their much-anticipated Honor 3c smartphones last month here in Nepal and that too at a decent price of NPR.24000(The market value is around NPR. 22500). Let’s check on our review if this phone is punching above its weight.  OVERVIEW  Honor 3c offers a 5 ″(720 x 1280 pixels ~294 ppi pixel density) \xa0IPS LCD display and runs on a 1.3 GHz Quad-Core\xa0MediaTek processor with 2 GB of RAM. On-board you get 8 GB of storage but you can\xa0expand it further with microSD card expandable up to 32 GB.  For taking pictures it comes with an 8 MP Sony BSI\xa0camera with assisted LED flash at the back and a front facing 5\xa0MP camera for selfies. Juicing up the device is a \xa0rather generous 2,300 mAh battery. It currently runs on\xa0Android 4.2.2 Jelly Bean with Emotion UI on top of it.        PROS   Very good HD Screen  2 GB of RAM  Excellent Battery Life   CONS   MediaTek Processor overheating issues  Emotion UI   DESIGN AND BUILD QUALITY  Being a midrange phone, the Huawei honor 3c has all plastic body but the quality of plastic doesn’t feel cheap.The plastic has a glossy slippery back but we wished the back had a matt finish. Standing a 9.1 mm thick and weighing just 140gms, the phone doesn’t feel heavy in the hands.  The power and volume keys are made from metal and feel premium.   \xa0On the bottom, we have a micro-USB port and a microphone.   On the backside, we have an 8MP camera with LED flash and a noise cancellation mic on the top. We have the speaker grill on the left side.   \xa0 The back of the honor 3c is removable and the back cover seems to be durable but a flip cover is always recommended.Inside the phone, we have a 2 micro-SIM slots and a microSD slot for memory expansion. Out of the two SIM slots, one is 3G+ i.e HPSDA 2100 and another is 2G.\xa0  SCREEN  Given the price, the Honor 3c’s greatest attribute is the screen. With HD 720p resolution and a 5-inch display, it has quite a respectable pixel density of 294ppi.The Screen is based on IPS technology and hence it has a good color saturation, decent contrast level and very bright and vivid. The touch of the screen is also very responsive and can support up to 10 fingers. Overall, the screen of Honor 3c is one of the best under its price segment. Only cons about the screen are there is no Gorilla Glass protection.  USER INTERFACE  This phone currently runs on Android 4.2.2 Jelly bean with Emotion UI V2.0 on top of it. KitKat update should be rolling out soon as well. The Chinese version of Honor 3c has already got it so it’s just a matter of time for international users.  The Emotion UI is a bit different. You don’t have an App drawer so all apps are placed on the home screen like in iPhone. There are some cool features added in the Emotion UI. For eg., Networked apps is a great app where you can select which connectivity to us: WIFI or DATA.\xa0Power Saving apps allow you to save battery life to some extent.But the best feature of Honor 3c’s software is the “Knock on”. Double tapping the screen wakes up your phone.  Here are some screen shots of Emotion UI :             PERFORMANCE  The Honor 3c is powered by a MediaTek MT6582 Chipset. There are 4 cortex A7 processor clocked at 1.2 GHz. The Quad Core processor is paired with MALI 400MP2 GPU. It has 2GB of RAM, twice as much as seen in other mid-range handset. We have a 8 GB of internal storage that can be expanded upon by inserting a MicroSD card. Many apps and games can be moved from internal storage to MicroSD.   The performance of this device is fast. You won’t feel lag while running multiple application while scrolling through home screen or browsing. Moreover, the additional RAM comes handy while multitasking.   You can play all source of game, but the rendering and detailing won’t be great as high-end devices.You will notice heating issues on the backside while playing high-end games.   The device scores around 6000 in Quadrant Standard, 17000 in Antutu and 54.3 FPS in NenaMark2.     CAMERA  Honor 3c features an 8MP rear camera which in my opinion produces average photo quality. You can capture photos in different modes like HDR and panorama. You can record videos at 1080P at 30 frames per second. The details of the photo aren’t that bad but the color and contrast level are relatively low. The picture quality falls dramatically in low light but thanks to LED flash, it can take some good shots.\xa0  Honor 3c is a selfie lover’s dream with its 5MP front camera that has a wide angle lens to include all your friends 😉\xa0  BATTERY\xa0  With 2300 mAh battery, the Honor 3c holds enough charge to last for a whole day of normal usage. On the benchmark test, it lasted around 16hrs and we often used WIFI, GPS, Bluetooth and played games for a long time.  AUDIO & CALL QUALITY  Huawei Honor 3c features DTS sound and is loud when played on the speaker. While playing games, the sound is nice and pleasant. However, the call quality is not that great. There is some distortion while calling.  CONNECTIVITY  Honor 3c is a Dual SIM phone. SIM-1 is 3G+ which means it supports\xa0downlink speeds of up to 42 Mbit/s. SIM-2 is 2G. For connectivity, there is\xa0Wi-Fi 802.11 b/g/n, Wi-Fi Direct, DLNA, Wi-Fi hotspot, Bluetooth 4.0. However, there is no NFC and USB on the go (OTG).\xa0  INSIDE THE BOX\xa0    Handset  Ear piece  Wall Charger  Data Cable  Flip cover  Screen Guard  Warranty card  Quick Guide    VERDICT\xa0  Huawei Honor 3c offers premium features at a very affordable price. As compared to Samsung or HTC, it has almost double the specs. The only downside to this otherwise excellent phone is the low-cost MediaTek chipset that heats up occasionally. We wished it was Snapdragon 400!']",[]
['Price of LG G3 in Nepal'],['LG'],['By Yural Maskey -  '],"['July 26, 2014']",2014-07-26 03:36:04+00:00,"['Price of LG G3 in Nepal\xa0  CG digital,the authorized dealer of LG smartphones in Nepal, is yet to launch their flagship smartphone in Nepal. However,its available in grey markets of Nepal. The sucessor of the previous version LG G2 offers QHD screen and the latest & greatest Snapdragon 801 chipset.          KEY SPECIFICATIONS:    Chipset: Qualcomm Snapdragon™ 801 (up to 2.5 GHz Quad-Core)  Display: 5.5-inch Quad HD IPS (2560 x 1440, 538 ppi)  Memory: 16GB/32GB eMMC ROM, 2GB/3GB DDR3 RAM / micro SD slot (128GB max)  Camera: Rear 13.0MP with OIS+ and Laser Auto Focus / Front 2.1MP  Battery: 3,000mAh (removable)  Operating System: Android 4.4.2 KitKat  Size: 146.3 x 74.6 x 8.9mm  Weight: 149 gms.  Network: 4G / LTE / HSPA+ 21 Mbps (3G)  Connectivity: Wi-Fi 802.11 a/b/g/n/ac, Bluetooth Smart Ready (Apt-X), NFC,\xa0SlimPort, A-GPS/Glonass, USB 2.0  Color: Metallic Black, Silk White, Shine Gold, Moon Violet, Burgundy Red  Other: Smart Keyboard, Smart Notice, Knock CodeTM, Guest Mode, etc.   WHERE TO BUY LG G3 IN NEPAL?   16GB version Listed at\xa0 M.K.Trade Line – Mobile Traders \xa0(Rs.70000)  32GB version Listed at\xa0 Aamachhori DOT com \xa0(Rs.74500) Link-> HERE']",['https://oss.gadgetbytenepal.com/wp-content/uploads/2014/05/lg-g3-fan.jpg']
['Modern Combat 5 released:Spectacular game!'],[],['By Yural Maskey -  '],"['July 24, 2014']",2014-07-24 10:42:31+00:00,"['Gameloft \xa0today released their 5th edition of Modern Combat and is available for download in iOS and Android. It will cost you $8.99 for iOS and $6.99 for Android. However, you can download it via Torrent for free! Links are\xa0provided below:  iOS Link:  HERE  Googleplay Link:  HERE        Torrent Link(Android):  HERE   It’s obvious\xa0that you aint paying so here’s how you install after downloading from Torrent:  1.Copy ‘com.gameloft.android.ANMP.GloftM5HM’ folder to ‘sdcard/Android/obb’ 2.Install APK 3.Launch the game  Enjoy!!']",['https://oss.gadgetbytenepal.com/wp-content/uploads/2014/07/Featured3.png']
['Get your GoPro Hero 3 Black Edition in Nepal'],[],['By Yural Maskey -  '],"['July 24, 2014']",2014-07-24 03:46:51+00:00,"['Everyone knows that GoPro is the go to camera for capturing action. They got that way with a great product and even better marketing. Everywhere you turn when it comes to action sports and tv shows you see a GoPro.  The GoPro Hero 3 Black Edition is a very versatile wearable camera system that can shoot in Super HD all the way down to WVGA. With a range of frame rates including the excellent 1080p/60 and 720p/120 you can capture even the smallest slice of time with ease.    KEY CAMERA SPECS    Professional 4K Cinema 15 fps / 2.7K cinema 30 fps / 1440p 48 fps / 1080p 60 fps / 960p 100 fps /720p 120 fps and more video capture  \xa012MP / 30 fps Burst  \xa0GoPro App + Remote Compatible  \xa04Kp15 / 2.7Kp30 / 1440p48 fps  \xa0SuperView Mode  \xa0Auto Low Light Mode  Wi-Fi Built-In  Wi-Fi Remote Compatible (included)  GoPro App Compatible (FREE)  197’/ 60m Waterproof Housing*  Assorted mounts and hardware included for attaching to helmets, gear and more   Key Benefits   Wearable, mountable design  Immersive, wide angle capture of your favourite activities  Professional quality HD video & 12MP photos  Built-in Wi-Fi enables remote control via included Wi-Fi Remote or live video preview and remote control on Smartphones and tablets running the free GoPro app.  Rugged housing is waterproof to 197’/60M and captures sharp images above and below water  Compatible with all GoPro mounts for attaching to gear, body, helmets, vehicles and more  Compatible with LCD Touch BacPac™ and second generation Battery BacPac™  Backwards compatible with older generation BacPacs™  New advanced camera settings: Looping video, Continuous Photo, Manual White Balance control, Protune Mode, allows to shoot photos while recording video and more   Source: Link         Price in Nepal  The\xa0\xa0GoPro Hero 3 is priced at Rs.\xa0 53500 and is Listed at aamachhori.com. Contact details:\xa09849647261/9818970674']",['https://oss.gadgetbytenepal.com/wp-content/uploads/2014/07/pdp_image_HERO3Plus_black_cluster1.jpg']
"['Colors K22 Octa specifications, Features and Price']",['Colors'],['By Yural Maskey -  '],"['July 23, 2014']",2014-07-23 05:34:37+00:00,"['Tele Talk, the authorized distributor of  Colors Mobile in Nepal , announced its flagship phone- “Pearl Black K22 Octa” in May. However, the\xa0Colors K22 Octa is available for purchase now for a price of Rs.29500 or Rs.2475 per month for 12 months. The successor of 2013 flagship- Pearl Black K1 Amoled and Pearl Black K2, K22 octa offers competitions to  Samsung Grand 2  and  Micromax Canvas Knight .             KEY SPECS OF COLORS K22 OCTA :   Colors K22 Octa runs on\xa0 Android v4.4 KitKat.  It features a\xa0 5″IPS HD capacitive \xa0touchscreen with pixel density of\xa0 ~294 ppi  The screen has a 88 degree Wide Angle and a third generation Gorilla Glass protection  It has a\xa0 13 MP \xa0primary camera with\xa0 LED flash\xa0 and a\xa0 5 MP secondary camera  Rear Camera has a RGBW sensor and \xa0f2.2 Lens  It is powered with a\xa0 1.7 GHz octa-core \xa0MediaTek MT6592 processor  It has\xa0 2 GB of RAM\xa0 and\xa0 16 GB of ROM\xa0 with upto\xa032GB  microSD \xa0support for memory expansion  Wolfson codec Dual Speaker  Connectivity options in the device includes\xa0 3G, Wi-Fi, Bluetooth, USB & USB on-the-go  It has a\xa0 2250 mAh \xa0battery on board.  price : Rs.29500 or Rs.2475 per month for 12 months   Box Contents   Leather Case, Scratch-guards, Charger, USB cable and headphones  Warranty card, User guide, List of service centres   PROS   Stunning design having premium look  Vivid IPS screen   CONS   Heating issues  Poor low-light imaging']",['https://oss.gadgetbytenepal.com/wp-content/uploads/2014/07/10525967_748991805164975_6548827469401517944_n.jpg']
['Xiaomi Mi4 Launched: All you need to Know'],['Xiaomi'],['By Yural Maskey -  '],"['July 23, 2014']",2014-07-23 02:35:20+00:00,"['Xiaomi launched their Flagship phone in Beijing yesterday and they believe it is the World’s fastest phone. Powered by a 2.5GHz Snapdragon 801 quad-core processor, a 5-inch Full HD display, and 3GB of RAM, it well could justify its clause.   It has a 13-megapixel rear camera, 8-megapixel front-facing unit, and sizeable 3080 mAh battery, and it runs Android KitKat with the MIUI 6 skin. There is a\xa016GB and 64GB internal storage options. However, it lacks a microSD card slot.\xa0         The 13 MegaPixel rear camera comes with a\xa0f/1.8 aperture, Sony IMX214 lens, and real-time HDR, 4K video recording. The front 8 MegaPixel camera has an f1.8 aperture, 80-degree wide angle Sony IMX219 lens.   About the build quality,  they’ve opted to build the Xiaomi Mi4′s body completely out of metal, to give it that rigid and premium feel. Xiaomi mi4 will be available for pre order later this month and the price will be just $320/$400 in China. Xiaomi promises to expand their\xa0territory\xa0to other nations too within the next month.']",['https://oss.gadgetbytenepal.com/wp-content/uploads/2014/07/Xiaomi-Mi4-11-1.jpg']
